"","x"
"803","contra la persona de que se trate, salvo que la decision haya obedecido a que"
"804","no este dispuesto a llevar a cabo el enjuiciamiento o no pueda realmente hacerlo;"
"805","c) La persona de que se trate haya sido ya enjuiciada por la"
"806","conducta a que se refiere la denuncia, y la Corte no pueda incoar el juicio"
"807","con arreglo a lo dispuesto en el parrafo 3 del articulo 20;"
"808","d) El asunto no sea de gravedad suficiente para justificar"
"809","la adopcion de otras medidas por la Corte."
"810","2. A fin de determinar si hay o no disposicion a actuar en"
"811","un asunto determinado, la Corte examinara, teniendo en cuenta los principios"
"812","de un proceso con las debidas garantias reconocidos por el derecho internacional,"
"813","si se da una o varias de las siguientes circunstancias, segun el caso:"
"814","a) Que el juicio ya haya estado o este en marcha o que la decision"
"815","nacional haya sido adoptada con el proposito de sustraer a la persona de que"
"816","se trate de su responsabilidad penal por crimenes de la competencia de la Corte,"
"817","segun lo dispuesto en el articulo 5;"
"818","b) Que haya habido una demora injustificada en el juicio que,"
"819","dadas las circunstancias, sea incompatible con la intencion de hacer comparecer"
"820","a la persona de que se trate ante la justicia;"
"821","c) Que el proceso no haya sido o no este siendo sustanciado"
"822","de manera independiente o imparcial y haya sido o este siendo sustanciado de"
"823","forma en que, dadas las circunstancias, sea incompatible con la intencion de"
"824","hacer comparecer a la persona de que se trate ante la justicia."
"825","3. A fin de determinar la incapacidad para investigar o enjuiciar"
"826","en un asunto determinado, la Corte examinara si el Estado, debido al colapso"
"827","total o sustancial de su administracion nacional de justicia o al hecho de que"
"828","carece de ella, no puede hacer comparecer al acusado, no dispone de las pruebas"
"829","y los testimonios necesarios o no esta por otras razones en condiciones de llevar"
"830","a cabo el juicio."
"831","Articulo 18"
"832","Dictamenes preliminares relativos a la admisibilidad"
"833","1. Cuando se haya remitido a la Corte una situacion en virtud"
"834","del articulo 13 a) y el Fiscal haya determinado que existen fundamentos razonables"
"835","para comenzar una investigacion e inicie esa investigacion en virtud de los"
"836","articulos 13 c) y 15, lo notificara a todos los Estados Partes y a aquellos"
"837","Estados que, teniendo en cuenta la informacion disponible, ejercerian normalmente"
"838","la jurisdiccion sobre los crimenes de que se trate. El Fiscal podra hacer la"
"839","notificacion a esos Estados con caracter confidencial y, cuando lo considere"
"840","necesario a fin de proteger personas, impedir la destruccion de pruebas o impedir"
"841","la fuga de personas, podra limitar el alcance de la informacion proporcionada"
"842","a los Estados."
"843","2. Dentro del mes siguiente a la recepcion de dicha notificacion,"
"844","el Estado podra informar a la Corte de que esta llevando o ha llevado a cabo"
"845","una investigacion en relacion con sus nacionales u otras personas bajo su jurisdiccion"
"846","respecto de actos criminales que puedan constituir los crimenes a que se refiere"
"847","el articulo 5 y a los que se refiera la informacion proporcionada en la notificacion"
"848","a los Estados. A peticion de dicho Estado, el Fiscal se inhibira de su competencia"
"849","en favor del Estado en relacion con la investigacion sobre las personas antes"
"850","mencionadas, a menos que la Sala de Cuestiones Preliminares decida, a peticion"
"851","del Fiscal autorizar la investigacion."
"852","3. El Fiscal podra volver a examinar la cuestion de la inhibicion"
"853","de su competencia al cabo de seis meses a partir de la fecha de la remision"
"854","o cuando se haya producido un cambio significativo de circunstancias en vista"
"855","de que el Estado no esta dispuesto a llevar a cabo la investigacion o no puede"
"856","realmente hacerlo."
"857","4. El Estado de que se trate o el Fiscal podran apelar ante"
"858","la Sala de Apelaciones del dictamen de la Sala de Cuestiones Preliminares, de"
"859","conformidad con el articulo 82. La apelacion podra sustanciarse en forma sumaria."
"860","5. Cuando el Fiscal se haya inhibido de su competencia en relacion"
"861","con la investigacion con arreglo a lo dispuesto en el parrafo 2, podra pedir"
"862","al Estado de que se trate que le informe periodicamente de la marcha de sus"
"863","investigaciones y del juicio ulterior. Los Estados Partes responderan a esas"
"864","peticiones sin dilaciones indebidas."
"865","6. El Fiscal podra, hasta que la Sala de Cuestiones Preliminares"
"866","haya emitido su dictamen, o en cualquier momento si se hubiere inhibido de su"
"867","competencia en virtud de este articulo, pedir a la Sala de Cuestiones Preliminares,"
"868","con caracter excepcional, que le autorice a llevar adelante las indagaciones"
"869","que estime necesarias cuando exista una oportunidad unica de obtener pruebas"
"870","importantes o exista un riesgo significativo de que esas pruebas no esten disponibles"
"871","ulteriormente."
"872","7. El Estado que haya apelado de un dictamen de la Sala de"
"873","Cuestiones Preliminares en virtud del presente articulo podra impugnar la admisibilidad"
"874","de un asunto en virtud del articulo 19, haciendo valer hechos nuevos importantes"
"875","o un cambio significativo de las circunstancias."
"876","Articulo 19"
"877","Impugnacion de la competencia de la Corte o de la admisibilidad"
"878","de la causa"
"879","1. La Corte se cerciorara de ser competente en todas las causas"
"880","que le sean sometidas. La Corte podra determinar de oficio la admisibilidad"
"881","de una causa de conformidad con el articulo 17."
"882","2. Podran impugnar la admisibilidad de la causa, por uno de"
"883","los motivos mencionados en el articulo 17, o impugnar la competencia de la Corte:"
"884","a) El acusado o la persona contra la cual se haya dictado una"
"885","orden de detencion o una orden de comparecencia con arreglo al articulo 58;"
"886","b) El Estado que tenga jurisdiccion en la causa porque esta"
"887","investigandola o enjuiciandola o lo ha hecho antes; o"
"888","c) El Estado cuya aceptacion se requiera de conformidad con"
"889","el articulo 12."
"890","3. El Fiscal podra pedir a la Corte que se pronuncie sobre"
"891","una cuestion de competencia o de admisibilidad. En las actuaciones relativas"
"892","a la competencia o la admisibilidad, podran presentar asimismo observaciones"
"893","a la Corte quienes hayan remitido la situacion de conformidad con el articulo"
"894","13 y las victimas."
"895","4. La admisibilidad de una causa o la competencia de la Corte"
"896","solo podran ser impugnadas una sola vez por cualquiera de las personas o los"
"897","Estados a que se hace referencia en el parrafo 2. La impugnacion se hara antes"
"898","del juicio o a su inicio. En circunstancias excepcionales, la Corte podra autorizar"
"899","que la impugnacion se haga mas de una vez o en una fase ulterior del juicio."
"900","Las impugnaciones a la admisibilidad de una causa hechas al inicio del juicio,"
"901","o posteriormente con la autorizacion de la Corte, solo podran fundarse en el"
"902","parrafo 1 c) del articulo 17."
"903","5. El Estado a que se hace referencia en los apartados b) y"
"904","c) del parrafo 2 del presente articulo hara la impugnacion lo antes posible."
"905","6. Antes de la confirmacion de los cargos, la impugnacion de"
"906","la admisibilidad de una causa o de la competencia de la Corte sera asignada"
"907","a la Sala de Cuestiones Preliminares. Despues de confirmados los cargos, sera"
"908","asignada a la Sala de Primera Instancia. Las decisiones relativas a la competencia"
"909","o la admisibilidad podran ser recurridas ante la Sala de Apelaciones de conformidad"
"910","con el articulo 82."
"911","7. Si la impugnacion es hecha por el Estado a que se hace referencia"
"912","en los apartados b) o c) del parrafo 2, el Fiscal suspendera la investigacion"
"913","hasta que la Corte resuelva de conformidad con el articulo 17."
"914","8. Hasta que la Corte se pronuncie, el Fiscal podra pedirle"
"915","autorizacion para:"
"916","a) Practicar las indagaciones necesarias de la indole mencionada"
"917","en el parrafo 6 del articulo 18;"
"918","b) Tomar declaracion a un testigo o recibir su testimonio,"
"919","o completar la reunion y el examen de las pruebas que hubiere iniciado antes"
"920","de la impugnacion; y"
"921","c) Impedir, en cooperacion con los Estados que corresponda,"
"922","que eludan la accion de la justicia personas respecto de las cuales el Fiscal"
"923","haya pedido ya una orden de detencion en virtud del articulo 58."
"924","9. La impugnacion no afectara a la validez de ningun acto realizado"
"925","por el Fiscal, ni de ninguna orden o mandamiento dictado por la Corte, antes"
"926","de ella."
"927","10. Si la Corte hubiere declarado inadmisible una causa de"
"928","conformidad con el articulo 17, el Fiscal podra pedir que se revise esa decision"
"929","cuando se haya cerciorado cabalmente de que han aparecido nuevos hechos que"
"930","invalidan los motivos por los cuales la causa habia sido considerada inadmisible"
"931","de conformidad con dicho articulo."
"932","11. El Fiscal, si habida cuenta de las cuestiones a que se"
"933","refiere el articulo 17 suspende una investigacion, podra pedir que el Estado"
"934","de que se trate le comunique informacion sobre las actuaciones. A peticion de"
"935","ese Estado, dicha informacion sera confidencial. El Fiscal, si decide posteriormente"
"936","abrir una investigacion, notificara su decision al Estado cuyas actuaciones"
"937","hayan dado origen a la suspension."
"938","Articulo 20"
"939","Cosa juzgada"
"940","1. Salvo que en el presente Estatuto se disponga otra cosa,"
"941","nadie sera procesado por la Corte en razon de conductas constitutivas de crimenes"
"942","por los cuales ya hubiere sido condenado o absuelto por la Corte."
"943","2. Nadie sera procesado por otro tribunal en razon de uno de"
"944","los crimenes mencionados en el articulo 5 por el cual la Corte ya le hubiere"
"945","condenado o absuelto."
"946","3. La Corte no procesara a nadie que haya sido procesado por"
"947","otro tribunal en razon de hechos tambien prohibidos en virtud de los articulos"
"948","6, 7 u 8 a menos que el proceso en el otro tribunal:"
"949","a) Obedeciera al proposito de sustraer al acusado de su responsabilidad"
"950","penal por crimenes de la competencia de la Corte; o"
"951","b) No hubiere sido instruida en forma independiente o imparcial"
"952","de conformidad con las debidas garantias procesales reconocidas por el derecho"
"953","internacional o lo hubiere sido de alguna manera que, en las circunstancias"
"954","del caso, fuere incompatible con la intencion de someter a la persona a la accion"
"955","de la justicia."
"956","Articulo 21"
"957","Derecho aplicable"
"958","1. La Corte aplicara:"
"959","a) En primer lugar, el presente Estatuto, los Elementos del"
"960","Crimen y sus Reglas de Procedimiento y Prueba;"
"961","b) En segundo lugar, cuando proceda, los tratados y los principios"
"962","y normas de derecho internacional aplicables, incluidos los principios establecidos"
"963","del derecho internacional de los conflictos armados;"
"964","c) En su defecto, los principios generales del derecho que"
"965","derive la Corte del derecho interno de los sistemas juridicos del mundo, incluido,"
"966","cuando proceda, el derecho interno de los Estados que normalmente ejercerian"
"967","jurisdiccion sobre el crimen, siempre que esos principios no sean incompatibles"
"968","con el presente Estatuto ni con el derecho internacional ni las normas y principios"
"969","internacionalmente reconocidos."
"970","2. La Corte podra aplicar principios y normas de derecho respecto"
"971","de los cuales hubiere hecho una interpretacion en decisiones anteriores."
"972","3. La aplicacion e interpretacion del derecho de conformidad"
"973","con el presente articulo debera ser compatible con los derechos humanos internacionalmente"
"974","reconocidos, sin distincion alguna basada en motivos como el genero, definido"
"975","en el parrafo 3 del articulo 7, la edad, la raza, el color, la religion o el"
"976","credo, la opinion politica o de otra indole, el origen nacional, etnico o social,"
"977","la posicion economica, el nacimiento u otra condicion."
"978","PARTE III. DE LOS PRINCIPIOS GENERALES DE DERECHO PENAL"
"979","Articulo 22"
"980","Nullum crimen sine lege"
"981","1. Nadie sera penalmente responsable de conformidad con el"
"982","presente Estatuto a menos que la conducta de que se trate constituya, en el"
"983","momento en que tiene lugar, un crimen de la competencia de la Corte."
"984","2. La definicion de crimen sera interpretada estrictamente"
"985","y no se hara extensiva por analogia. En caso de ambiguedad, sera interpretada"
"986","en favor de la persona objeto de investigacion, enjuiciamiento o condena."
"987","3. Nada de lo dispuesto en el presente articulo afectara a"
"988","la tipificacion de una conducta como crimen de derecho internacional independientemente"
"989","del presente Estatuto."
"990","Articulo 23"
"991","Nulla poena sine lege"
"992","Quien sea declarado culpable por la Corte unicamente podra"
"993","ser penado de conformidad con el presente Estatuto."
"994","Articulo 24"
"995","Irretroactividad ratione personae"
"996","1. Nadie sera penalmente responsable de conformidad con el"
"997","presente Estatuto por una conducta anterior a su entrada en vigor."
"998","2. De modificarse el derecho aplicable a una causa antes de"
"999","que se dicte la sentencia definitiva, se aplicaran las disposiciones mas favorables"
"1000","a la persona objeto de la investigacion, el enjuiciamiento o la condena."
"1001","Articulo 25"
"1002","Responsabilidad penal individual"
"1003","1. De conformidad con el presente Estatuto, la Corte tendra"
"1004","competencia respecto de las personas naturales."
"1005","2. Quien cometa un crimen de la competencia de la Corte sera"
"1006","responsable individualmente y podra ser penado de conformidad con el presente"
"1007","Estatuto."
"1008","3. De conformidad con el presente Estatuto, sera penalmente"
"1009","responsable y podra ser penado por la comision de un crimen de la competencia"
"1010","de la Corte quien:"
"1011","a) Cometa ese crimen por si solo, con otro o por conducto de"
"1012","otro, sea este o no penalmente responsable;"
"1013","b) Ordene, proponga o induzca la comision de ese crimen, ya"
"1014","sea consumado o en grado de tentativa;"
"1015","c) Con el proposito de facilitar la comision de ese crimen,"
"1016","sea complice o encubridor o colabore de algun modo en la comision o la tentativa"
"1017","de comision del crimen, incluso suministrando los medios para su comision;"
"1018","d) Contribuya de algun otro modo en la comision o tentativa"
"1019","de comision del crimen por un grupo de personas que tengan una finalidad comun."
"1020","La contribucion debera ser intencional y se hara:"
"1021","i) Con el proposito de llevar a cabo la actividad o proposito"
"1022","delictivo del grupo, cuando una u otro entrane la comision de un crimen de la"
"1023","competencia de la Corte; o"
"1024","ii) A sabiendas de que el grupo tiene la intencion de cometer"
"1025","el crimen;"
"1026","e) Respecto del crimen de genocidio, haga una instigacion directa"
"1027","y publica a que se cometa;"
"1028","f) Intente cometer ese crimen mediante actos que supongan un"
"1029","paso importante para su ejecucion, aunque el crimen no se consume debido a circunstancias"
"1030","ajenas a su voluntad. Sin embargo, quien desista de la comision del crimen o"
"1031","impida de otra forma que se consuma no podra ser penado de conformidad con el"
"1032","presente Estatuto por la tentativa si renunciare integra y voluntariamente al"
"1033","proposito delictivo."
"1034","4. Nada de lo dispuesto en el presente Estatuto respecto de"
"1035","la responsabilidad penal de las personas naturales afectara a la responsabilidad"
"1036","del Estado conforme al derecho internacional."
"1037","Articulo 26"
"1038","Exclusion de los menores de 18 anos de la competencia de"
"1039","la Corte"
"1040","La Corte no sera competente respecto de los que fueren menores"
"1041","de 18 anos en el momento de la presunta comision del crimen."
"1042","Articulo 27"
"1043","Improcedencia del cargo oficial"
"1044","1. El presente Estatuto sera aplicable por igual a todos sin"
"1045","distincion alguna basada en el cargo oficial. En particular, el cargo oficial"
"1046","de una persona, sea Jefe de Estado o de Gobierno, miembro de un gobierno o parlamento,"
"1047","representante elegido o funcionario de gobierno, en ningun caso la eximira de"
"1048","responsabilidad penal ni constituira per se motivo para reducir la pena."
"1049","2. Las inmunidades y las normas de procedimiento especiales"
"1050","que conlleve el cargo oficial de una persona, con arreglo al derecho interno"
"1051","o al derecho internacional, no obstaran para que la Corte ejerza su competencia"
"1052","sobre ella."
"1053","Articulo 28"
"1054","Responsabilidad de los jefes y otros superiores"
"1055","Ademas de otras causales de responsabilidad penal de conformidad"
"1056","con el presente Estatuto por crimenes de la competencia de la Corte:"
"1057","1. El jefe militar o el que actue efectivamente como jefe militar"
"1058","sera penalmente responsable por los crimenes de la competencia de la Corte que"
"1059","hubieren sido cometidos por fuerzas bajo su mando y control efectivo, o su autoridad"
"1060","y control efectivo, segun sea el caso, en razon de no haber ejercido un control"
"1061","apropiado sobre esas fuerzas cuando:"
"1062","a) Hubiere sabido o, en razon de las circunstancias del momento,"
"1063","hubiere debido saber que las fuerzas estaban cometiendo esos crimenes o se proponian"
"1064","cometerlos; y"
"1065","b) No hubiere adoptado todas las medidas necesarias y razonables"
"1066","a su alcance para prevenir o reprimir su comision o para poner el asunto en"
"1067","conocimiento de las autoridades competentes a los efectos de su investigacion"
"1068","y enjuiciamiento."
"1069","2. En lo que respecta a las relaciones entre superior y subordinado"
"1070","distintas de las senaladas en el apartado a), el superior sera penalmente responsable"
"1071","por los crimenes de la competencia de la Corte que hubieren sido cometidos por"
"1072","subordinados bajo su autoridad y control efectivo, en razon de no haber ejercido"
"1073","un control apropiado sobre esos subordinados, cuando:"
"1074","a) Hubiere tenido conocimiento o deliberadamente hubiere hecho"
"1075","caso omiso de informacion que indicase claramente que los subordinados estaban"
"1076","cometiendo esos crimenes o se proponian cometerlos;"
"1077","b) Los crimenes guardaren relacion con actividades bajo su"
"1078","responsabilidad y control efectivo; y"
"1079","c) No hubiere adoptado todas las medidas necesarias y razonables"
"1080","a su alcance para prevenir o reprimir su comision o para poner el asunto en"
"1081","conocimiento de las autoridades competentes a los efectos de su investigacion"
"1082","y enjuiciamiento."
"1083","Articulo 29"
"1084","Imprescriptibilidad"
"1085","Los crimenes de la competencia de la Corte no prescribiran."
"1086","Articulo 30"
"1087","Elemento de intencionalidad"
"1088","1. Salvo disposicion en contrario, una persona sera penalmente"
"1089","responsable y podra ser penada por un crimen de la competencia de la Corte unicamente"
"1090","si actua con intencion y conocimiento de los elementos materiales del crimen."
"1091","2. A los efectos del presente articulo, se entiende que actua"
"1092","intencionalmente quien:"
"1093","a) En relacion con una conducta, se propone incurrir en ella;"
"1094","b) En relacion con una consecuencia, se propone causarla o"
"1095","es consciente de que se producira en el curso normal de los acontecimientos."
"1096","3. A los efectos del presente articulo, por ?conocimiento?"
"1097","se entiende la conciencia de que existe una circunstancia o se va a producir"
"1098","una consecuencia en el curso normal de los acontecimientos. Las palabras ?a"
"1099","sabiendas? y ?con conocimiento? se entenderan en el mismo sentido."
"1100","Articulo 31"
"1101","Circunstancias eximentes de responsabilidad penal"
"1102","1. Sin perjuicio de las demas circunstancias eximentes de responsabilidad"
"1103","penal establecidas en el presente Estatuto, no sera penalmente responsable quien,"
"1104","en el momento de incurrir en una conducta:"
"1105","a) Padeciere de una enfermedad o deficiencia mental que le"
"1106","prive de su capacidad para apreciar la ilicitud o naturaleza de su conducta,"
"1107","o de su capacidad para controlar esa conducta a fin de no transgredir la ley;"
"1108","b) Estuviere en un estado de intoxicacion que le prive de su"
"1109","capacidad para apreciar la ilicitud o naturaleza de su conducta, o de su capacidad"
"1110","para controlar esa conducta a fin de no transgredir la ley, salvo que se haya"
"1111","intoxicado voluntariamente a sabiendas de que, como resultado de la intoxicacion,"
"1112","probablemente incurriria en una conducta tipificada como crimen de la competencia"
"1113","de la Corte, o haya hecho caso omiso del riesgo de que ello ocurriere;"
"1114","c) Actuare razonablemente en defensa propia o de un tercero"
"1115","o, en el caso de los crimenes de guerra, de un bien que fuese esencial para"
"1116","su supervivencia o la de un tercero o de un bien que fuese esencial para realizar"
"1117","una mision militar, contra un uso inminente e ilicito de la fuerza, en forma"
"1118","proporcional al grado de peligro para el, un tercero o los bienes protegidos."
"1119","El hecho de participar en una fuerza que realizare una operacion de defensa"
"1120","no bastara para constituir una circunstancia eximente de la responsabilidad"
"1121","penal de conformidad con el presente apartado;"
"1122","d) Hubiere incurrido en una conducta que presuntamente constituya"
"1123","un crimen de la competencia de la Corte como consecuencia de coaccion dimanante"
"1124","de una amenaza inminente de muerte o lesiones corporales graves para el u otra"
"1125","persona, y en que se vea compelido a actuar necesaria y razonablemente para"
"1126","evitar esa amenaza, siempre que no tuviera la intencion de causar un dano mayor"
"1127","que el que se proponia evitar. Esa amenaza podra:"
"1128","i) Haber sido hecha por otras personas; o"
"1129","ii) Estar constituida por otras circunstancias ajenas a su"
"1130","control."
"1131","2. La Corte determinara si las circunstancias eximentes de"
"1132","responsabilidad penal admitidas por el presente Estatuto son aplicables en la"
"1133","causa de que este conociendo."
"1134","3. En el juicio, la Corte podra tener en cuenta una circunstancia"
"1135","eximente de responsabilidad penal distinta de las indicadas en el parrafo 1"
"1136","siempre que dicha circunstancia se desprenda del derecho aplicable de conformidad"
"1137","con el articulo 21. El procedimiento para el examen de una eximente de este"
"1138","tipo se establecera en las Reglas de Procedimiento y Prueba."
"1139","Articulo 32"
"1140","Error de hecho o error de derecho"
"1141","1. El error de hecho eximira de responsabilidad penal unicamente"
"1142","si hace desaparecer el elemento de intencionalidad requerido por el crimen."
"1143","2. El error de derecho acerca de si un determinado tipo de"
"1144","conducta constituye un crimen de la competencia de la Corte no se considerara"
"1145","eximente. Con todo, el error de derecho podra considerarse eximente si hace"
"1146","desaparecer el elemento de intencionalidad requerido por ese crimen o si queda"
"1147","comprendido en lo dispuesto en el articulo 33 del presente Estatuto."
"1148","Articulo 33"
"1149","Ordenes superiores y disposiciones legales"
"1150","1. Quien hubiere cometido un crimen de la competencia de la"
"1151","Corte en cumplimiento de una orden emitida por un gobierno o un superior, sea"
"1152","militar o civil, no sera eximido de responsabilidad penal a menos que:"
"1153","a) Estuviere obligado por ley a obedecer ordenes emitidas por"
"1154","el gobierno o el superior de que se trate;"
"1155","b) No supiera que la orden era ilicita; y"
"1156","c) La orden no fuera manifiestamente ilicita."
"1157","2. A los efectos del presente articulo, se entendera que las"
"1158","ordenes de cometer genocidio o crimenes de lesa humanidad son manifiestamente"
"1159","ilicitas."
"1160","PARTE IV. DE LA COMPOSICION Y ADMINISTRACION DE LA CORTE"
"1161","Articulo 34"
"1162","Organos de la Corte"
"1163","La Corte estara compuesta de los organos siguientes:"
"1164","a) La Presidencia;"
"1165","b) Una Seccion de Apelaciones, una Seccion de Primera Instancia"
"1166","y una Seccion de Cuestiones Preliminares;"
"1167","c) La Fiscalia;"
"1168","d) La Secretaria."
"1169","Articulo 35"
"1170","Desempeno del cargo de magistrado"
"1171","1. Todos los magistrados seran elegidos miembros de la Corte"
"1172","en regimen de dedicacion exclusiva y estaran disponibles para desempenar su"
"1173","cargo en ese regimen desde que comience su mandato."
"1174","2. Los magistrados que constituyan la Presidencia desempenaran"
"1175","sus cargos en regimen de dedicacion exclusiva tan pronto como sean elegidos."
"1176","3. La Presidencia podra, en funcion del volumen de trabajo"
"1177","de la Corte, y en consulta con los miembros de esta, decidir por cuanto tiempo"
"1178","sera necesario que los demas magistrados desempenen sus cargos en regimen de"
"1179","dedicacion exclusiva. Las decisiones que se adopten en ese sentido se entenderan"
"1180","sin perjuicio de lo dispuesto en el articulo 49."
"1181","4. Las disposiciones financieras relativas a los magistrados"
